{
  "apiVersion": "performance.overmesh.io/v1",
  "campaign": {
    "commit": "ceb2d46e5e1e40df37546e15e80086f164be022f",
    "deployment": "sha256:29a32be3d35e42cb6959f523a7f963ab5b8f0ea6b266bac0164be679645503de",
    "environment": "isolated-validation-vm-francecentral",
    "finishedAt": "2026-08-19T09:57:34.725258Z",
    "isolatedEnvironment": true,
    "projectVersion": "0.10.0",
    "ringHash": "sha256:d8e2b6aef1a8ea0e32d032c002e4f0f7f1f0493b49bf50172d8d6d2ee65ad425",
    "ringVersion": "1",
    "runId": "20260819T094234Z",
    "startedAt": "2026-08-19T09:43:22.148897Z",
    "storageApiVersion": "2024-08-04"
  },
  "cases": [
    {
      "concurrency": 1,
      "finishedAt": "2026-08-19T09:43:23.019852Z",
      "id": "put_blob-1kib-c1",
      "iterations": 30,
      "metrics": {
        "bytesPerSecond": 87116.444,
        "errorCount": 0,
        "maxMs": 15.776,
        "meanMs": 11.718,
        "minMs": 10.627,
        "operationsPerSecond": 85.075,
        "p50Ms": 11.37,
        "p90Ms": 12.351,
        "p95Ms": 15.442,
        "p99Ms": 15.776,
        "successCount": 30,
        "wallSeconds": 0.352631
      },
      "operation": "put_blob",
      "payload": "1kib",
      "payloadBytes": 1024,
      "startedAt": "2026-08-19T09:43:22.667186Z",
      "target": "direct",
      "targetFingerprint": "endpoint-832700daafabb96f",
      "warmupIterations": 3
    },
    {
      "concurrency": 1,
      "finishedAt": "2026-08-19T09:44:06.188355Z",
      "id": "put_blob-1kib-c1",
      "iterations": 30,
      "metrics": {
        "bytesPerSecond": 810.929,
        "errorCount": 0,
        "maxMs": 1669.936,
        "meanMs": 1262.617,
        "minMs": 1014.917,
        "operationsPerSecond": 0.792,
        "p50Ms": 1209.389,
        "p90Ms": 1560.94,
        "p95Ms": 1661.972,
        "p99Ms": 1669.936,
        "successCount": 30,
        "wallSeconds": 37.882483
      },
      "operation": "put_blob",
      "payload": "1kib",
      "payloadBytes": 1024,
      "serverTelemetry": {
        "backendRequests": {
          "byBackend": {
            "storage-a": 530,
            "storage-b": 441,
            "storage-c": 499
          },
          "byOperation": {
            "caller_put_data_file": 60,
            "control_acquire_lock": 30,
            "control_get_object": 840,
            "control_put_bytes": 510,
            "control_release_lock": 30
          },
          "byStatus": {
            "200": 270,
            "201": 600,
            "404": 600
          },
          "count": 1470,
          "responseHeadersDuration": {
            "count": 1470,
            "maxDurationUs": 173553,
            "p50DurationUs": 32754,
            "p95DurationUs": 45897,
            "p99DurationUs": 85152,
            "totalDurationUs": 42537973
          },
          "transportFailures": 0
        },
        "containerApp": {
          "cpuCores": {
            "average": 0.00266,
            "maximum": 0.003618,
            "samples": 2
          },
          "interval": "1m",
          "memoryBytes": {
            "average": 105464832.0,
            "maximum": 106360832.0,
            "samples": 2
          },
          "replicas": {
            "average": 10.0,
            "maximum": 10.0,
            "samples": 2
          },
          "window": {
            "finishedAt": "2026-08-19T09:44:47.247095Z",
            "startedAt": "2026-08-19T09:42:47.247096Z"
          }
        },
        "manifestSigning": {
          "byDomain": {
            "BlockManifest": 30,
            "CommitManifest": 60
          },
          "count": 90,
          "failures": 0,
          "maxDurationUs": 295791,
          "p50DurationUs": 47041,
          "p95DurationUs": 241516,
          "p99DurationUs": 295791,
          "totalDurationUs": 6056594
        }
      },
      "startedAt": "2026-08-19T09:43:28.305836Z",
      "target": "gateway",
      "targetFingerprint": "endpoint-75c816375b9d8504",
      "warmupIterations": 3
    },
    {
      "concurrency": 4,
      "finishedAt": "2026-08-19T09:44:39.215292Z",
      "id": "put_blob-1kib-c4",
      "iterations": 30,
      "metrics": {
        "bytesPerSecond": 236670.249,
        "errorCount": 0,
        "maxMs": 92.214,
        "meanMs": 16.284,
        "minMs": 9.979,
        "operationsPerSecond": 231.123,
        "p50Ms": 12.983,
        "p90Ms": 17.976,
        "p95Ms": 20.331,
        "p99Ms": 92.214,
        "successCount": 30,
        "wallSeconds": 0.129801
      },
      "operation": "put_blob",
      "payload": "1kib",
      "payloadBytes": 1024,
      "startedAt": "2026-08-19T09:44:39.085451Z",
      "target": "direct",
      "targetFingerprint": "endpoint-832700daafabb96f",
      "warmupIterations": 3
    },
    {
      "concurrency": 4,
      "finishedAt": "2026-08-19T09:44:50.206493Z",
      "id": "put_blob-1kib-c4",
      "iterations": 30,
      "metrics": {
        "bytesPerSecond": 3344.301,
        "errorCount": 0,
        "maxMs": 1341.135,
        "meanMs": 1180.64,
        "minMs": 873.239,
        "operationsPerSecond": 3.266,
        "p50Ms": 1223.268,
        "p90Ms": 1302.308,
        "p95Ms": 1325.309,
        "p99Ms": 1341.135,
        "successCount": 30,
        "wallSeconds": 9.185775
      },
      "operation": "put_blob",
      "payload": "1kib",
      "payloadBytes": 1024,
      "serverTelemetry": {
        "backendRequests": {
          "byBackend": {
            "storage-a": 496,
            "storage-b": 539,
            "storage-c": 435
          },
          "byOperation": {
            "caller_put_data_file": 60,
            "control_acquire_lock": 30,
            "control_get_object": 840,
            "control_put_bytes": 510,
            "control_release_lock": 30
          },
          "byStatus": {
            "200": 270,
            "201": 600,
            "404": 600
          },
          "count": 1470,
          "responseHeadersDuration": {
            "count": 1470,
            "maxDurationUs": 261846,
            "p50DurationUs": 34079,
            "p95DurationUs": 45387,
            "p99DurationUs": 51701,
            "totalDurationUs": 42796861
          },
          "transportFailures": 0
        },
        "containerApp": {
          "cpuCores": {
            "average": 0.001993,
            "maximum": 0.003119,
            "samples": 2
          },
          "interval": "1m",
          "memoryBytes": {
            "average": 105914470.4,
            "maximum": 107454464.0,
            "samples": 2
          },
          "replicas": {
            "average": 10.0,
            "maximum": 10.0,
            "samples": 2
          },
          "window": {
            "finishedAt": "2026-08-19T09:45:45.613583Z",
            "startedAt": "2026-08-19T09:43:45.613583Z"
          }
        },
        "manifestSigning": {
          "byDomain": {
            "BlockManifest": 30,
            "CommitManifest": 60
          },
          "count": 90,
          "failures": 0,
          "maxDurationUs": 85496,
          "p50DurationUs": 39648,
          "p95DurationUs": 71236,
          "p99DurationUs": 85496,
          "totalDurationUs": 3944762
        }
      },
      "startedAt": "2026-08-19T09:44:41.020673Z",
      "target": "gateway",
      "targetFingerprint": "endpoint-75c816375b9d8504",
      "warmupIterations": 3
    },
    {
      "concurrency": 16,
      "finishedAt": "2026-08-19T09:45:22.356639Z",
      "id": "put_blob-1kib-c16",
      "iterations": 30,
      "metrics": {
        "bytesPerSecond": 70395.445,
        "errorCount": 0,
        "maxMs": 396.374,
        "meanMs": 148.772,
        "minMs": 13.831,
        "operationsPerSecond": 68.746,
        "p50Ms": 45.115,
        "p90Ms": 372.192,
        "p95Ms": 391.539,
        "p99Ms": 396.374,
        "successCount": 30,
        "wallSeconds": 0.436392
      },
      "operation": "put_blob",
      "payload": "1kib",
      "payloadBytes": 1024,
      "startedAt": "2026-08-19T09:45:21.920181Z",
      "target": "direct",
      "targetFingerprint": "endpoint-832700daafabb96f",
      "warmupIterations": 3
    },
    {
      "concurrency": 16,
      "finishedAt": "2026-08-19T09:45:27.170568Z",
      "id": "put_blob-1kib-c16",
      "iterations": 30,
      "metrics": {
        "bytesPerSecond": 10033.594,
        "errorCount": 0,
        "maxMs": 1755.149,
        "meanMs": 1357.268,
        "minMs": 929.852,
        "operationsPerSecond": 9.798,
        "p50Ms": 1312.689,
        "p90Ms": 1733.004,
        "p95Ms": 1748.974,
        "p99Ms": 1755.149,
        "successCount": 30,
        "wallSeconds": 3.061714
      },
      "operation": "put_blob",
      "payload": "1kib",
      "payloadBytes": 1024,
      "serverTelemetry": {
        "backendRequests": {
          "byBackend": {
            "storage-a": 481,
            "storage-b": 508,
            "storage-c": 481
          },
          "byOperation": {
            "caller_put_data_file": 60,
            "control_acquire_lock": 30,
            "control_get_object": 840,
            "control_put_bytes": 510,
            "control_release_lock": 30
          },
          "byStatus": {
            "200": 270,
            "201": 600,
            "404": 600
          },
          "count": 1470,
          "responseHeadersDuration": {
            "count": 1470,
            "maxDurationUs": 94681,
            "p50DurationUs": 33409,
            "p95DurationUs": 45404,
            "p99DurationUs": 56014,
            "totalDurationUs": 42562536
          },
          "transportFailures": 0
        },
        "containerApp": {
          "cpuCores": {
            "average": 0.005171,
            "maximum": 0.016553,
            "samples": 2
          },
          "interval": "1m",
          "memoryBytes": {
            "average": 107945267.2,
            "maximum": 112062464.0,
            "samples": 2
          },
          "replicas": {
            "average": 10.0,
            "maximum": 10.0,
            "samples": 2
          },